,선명,역명,주소,위도,경도
0,1호선,동대문,서울특별시 종로구 종로 지하302(창신동),37.5728396,127.0144679
1,1호선,동묘앞,서울특별시 종로구 종로 359(숭인동),37.5775993,127.0223262
2,1호선,서울역,서울특별시 중구 세종대로 지하2(남대문로 5가),37.5587351,126.9738593
3,1호선,시청,서울특별시 중구 세종대로 지하101(정동),37.5666082,126.9731481
4,1호선,신설동,서울특별시 동대문구 왕산로 지하1(신설동),37.578486,127.0270996
5,1호선,제기동,서울특별시 동대문구 왕산로 지하93(제기동),37.5837593,127.0372351
6,1호선,종각,서울특별시 종로구 종로 지하55(종로1가),37.5700105,126.9821081
7,1호선,종로3가,서울특별시 종로구 종로 지하129(종로3가),37.5704474,126.990896
8,1호선,종로5가,서울특별시 종로구 종로 지하216(종로5가),37.571031,127.0019512
9,1호선,청량리(서울시립대입구),서울특별시 동대문구 왕산로 지하205(전농동),37.5797474,127.0557043
10,2호선,강남,서울특별시 강남구 강남대로 지하396(역삼동),37.5000776,127.0385419
11,2호선,강변(동서울터미널),서울특별시 광진구 강변역로 53(구의동),37.5353816,127.0945451
12,2호선,건대입구,서울특별시 광진구 아차산로 243(화양동),37.54081559999999,127.0690315
13,2호선,교대(법원·검찰청),서울특별시 서초구 서초대로 지하294(서초동),37.4910405,127.004581
14,2호선,구로디지털단지,서울특별시 구로구 도림천로 477(구로동),37.485363,126.9010775
15,2호선,구의(광진구청),서울특별시 광진구 아차산로 384-1(구의동),37.5444007,127.092844
16,2호선,까치산,서울특별시 강서구 강서로 지하54 ,37.5512896,126.8417531
17,2호선,낙성대,서울특별시 관악구 남부순환로 지하1928(봉천동),37.4799015,126.9404631
18,2호선,당산,서울특별시 영등포구 당산로 229(당산동6가),37.5346602,126.9028802
19,2호선,대림(구로구청),서울특별시 구로구 도림천로 351(구로동),37.4934315,126.8947998
20,2호선,도림천,서울특별시 구로구 경인로67길 160(신도림동),37.5142835,126.8829718
21,2호선,동대문역사문화공원,서울특별시 중구 을지로 지하279(을지로7가),37.5662916,127.0096225
22,2호선,뚝섬,서울특별시 성동구 아차산로 18(성수동1가),37.5463387,127.0535209
23,2호선,문래,서울특별시 영등포구 당산로 지하28(문래동3가),37.518811,126.8996216
24,2호선,방배,서울특별시 서초구 방배로 지하80(방배동),37.4870964,126.9958157
25,2호선,봉천,서울특별시 관악구 남부순환로 지하1721(봉천동),37.487812,126.957234
26,2호선,사당,서울특별시 동작구 남부순환로 지하2089(사당동),37.485622,126.9723172
27,2호선,삼성(무역센터),서울특별시 강남구 테헤란로 지하538(삼성동),37.508861,127.063149
28,2호선,상왕십리,서울특별시 성동구 왕십리로 지하374(하왕십리동),37.56398739999999,127.0280247
29,2호선,서울대입구(관악구청),서울특별시 관악구 남부순환로 지하1822(봉천동),37.4799015,126.9404631
30,2호선,서초,서울특별시 서초구 서초대로 지하233(서초동),37.4910405,127.004581
31,2호선,선릉,서울특별시 강남구 테헤란로 지하340(삼성동),37.508861,127.063149
32,2호선,성수,서울특별시 성동구 아차산로 100(성수동2가),37.5446813,127.0569827
33,2호선,시청,서울특별시 중구 서소문로 지하127(서소문동),37.561398,126.9740126
34,2호선,신답,서울특별시 성동구 천호대로 232(용답동),37.5706952,127.0454382
35,2호선,신당,서울특별시 중구 퇴계로 지하431-1(신당동),37.5654292,127.0134917
36,2호선,신대방,서울특별시 동작구 대림로 2(신대방동),37.487549,126.9129603
37,2호선,신도림,서울특별시 구로구 새말로 지하 117-21(신도림동),37.5088099,126.8912061
38,2호선,신림,서울특별시 관악구 남부순환로 지하1614(신림동),37.4867897,126.9276112
39,2호선,신설동,서울특별시 동대문구 왕산로 지하 1(신설동),37.578486,127.0270996
40,2호선,신정네거리,서울특별시 양천구 중앙로 지하261(신정동),37.5195255,126.8528661
41,2호선,신촌,서울특별시 마포구 신촌로 지하90(노고산동),37.5543865,126.9377806
42,2호선,아현,서울특별시 마포구 신촌로 지하270(아현동),37.5543934,126.9568563
43,2호선,양천구청,서울특별시 양천구 목동로3길 지하33(신정동),37.5113363,126.8630691
44,2호선,역삼,서울특별시 강남구 테헤란로 지하156(역삼동),37.500326,127.036087
45,2호선,영등포구청,서울특별시 영등포구 당산로 지하121(당산동3가),37.5265942,126.8984636
46,2호선,왕십리,서울특별시 성동구 왕십리로 지하300(행당동),37.5596331,127.0303221
47,2호선,용답,서울특별시 성동구 용답길 86(용답동),37.5669045,127.0496653
48,2호선,용두(동대문구청),서울특별시 동대문구 천호대로 지하129(용두동),37.5723955,127.0340943
49,2호선,을지로3가,서울특별시 중구 을지로 지하106(을지로3가),37.5662094,126.9902284
50,2호선,을지로4가,서울특별시 중구 을지로 지하178(을지로4가),37.5665899,126.9982939
51,2호선,을지로입구,서울특별시 중구 을지로 지하42(을지로1가),37.5666911,126.9802528
52,2호선,이대,서울특별시 마포구 신촌로 지하180(염리동),37.5469511,126.9438905
53,2호선,잠실(송파구청),서울특별시 송파구 올림픽로 지하265(신천동),37.52099219999999,127.0991094
54,2호선,잠실나루,서울특별시 송파구 오금로 20(신천동),37.5189313,127.104757
55,2호선,잠실새내,서울특별시 송파구 올림픽로 지하140(잠실동),37.5045774,127.0727245
56,2호선,종합운동장,서울특별시 송파구 올림픽로 지하23(잠실동),37.5166152,127.0877398
57,2호선,충정로(경기대입구),서울특별시 서대문구 서소문로 지하17(충정로3가),37.5634497,126.9611328
58,2호선,한양대,서울특별시 성동구 왕십리로 206(행당동),37.5608641,127.0367939
59,2호선,합정,서울특별시 마포구 양화로 지하55(서교동),37.554252,126.920258
60,2호선,홍대입구,서울특별시 마포구 양화로 지하160(동교동),37.5563194,126.9224078
61,3호선,가락시장,서울특별시 송파구 송파대로 지하257(가락동),37.4956865,127.1184047
62,3호선,경복궁(정부서울청사),서울특별시 종로구 사직로 지하130(적선동),37.574115,126.9743671
63,3호선,경찰병원,서울특별시 송파구 중대로 지하149(가락동),37.4919273,127.1159269
64,3호선,고속터미널,서울특별시 서초구 신반포로 지하188(반포동),37.5054982,127.0011512
65,3호선,교대(법원·검찰청),서울특별시 서초구 서초대로 지하294(서초동),37.4910405,127.004581
66,3호선,구파발,서울특별시 은평구 진관2로 지하15-25 (진관동),37.6358242,126.9241625
67,3호선,금호,서울특별시 성동구 동호로 지하104(금호동4가),37.5474644,127.0256553
68,3호선,남부터미널(예술의전당),서울특별시 서초구 서초중앙로 지하31(서초동),37.48114040000001,127.025186
69,3호선,녹번,서울특별시 은평구 통일로 지하602-1(녹번동),37.6046138,126.9323836
70,3호선,대청,서울특별시 강남구 일원로 지하2(일원동),37.4881652,127.0828815
71,3호선,대치,서울특별시 강남구 남부순환로 지하2952(대치동),37.493668,127.0619
72,3호선,도곡,서울특별시 강남구 남부순환로 지하2814(도곡동),37.48859059999999,127.0452757
73,3호선,독립문,서울특별시 서대문구 통일로 지하247(현저동),37.57142109999999,126.9560102
74,3호선,동대입구,서울특별시 중구 동호로 지하256(장충동2가),37.5605514,127.0057072
75,3호선,매봉,서울특별시 강남구 남부순환로 지하2744(도곡동),37.48859059999999,127.0452757
76,3호선,무악재,서울특별시 서대문구 통일로 지하361(홍제동),37.5827071,126.9373416
77,3호선,불광,서울특별시 은평구 통일로 지하723-1(대조동),37.61204770000001,126.923359
78,3호선,수서,서울특별시 강남구 광평로 지하270(수서동),37.4874685,127.1013245
79,3호선,신사,서울특별시 강남구 도산대로 지하102(신사동),37.52106819999999,127.03414
80,3호선,안국,서울특별시 종로구 율곡로 지하62(안국동),37.5772954,126.9840979
81,3호선,압구정,서울특별시 강남구 압구정로 지하172(신사동),37.5263577,127.0335584
82,3호선,약수,서울특별시 중구 다산로 지하122(신당동),37.5640139,127.0183877
83,3호선,양재(서초구청),서울특별시 서초구 남부순환로 지하2585(서초동),37.4785654,127.0078252
84,3호선,연신내,서울특별시 은평구 통일로 지하849(갈현동),37.621541,126.913578
85,3호선,오금,서울특별시 송파구 오금로 지하321(오금동),37.5041934,127.1344585
86,3호선,옥수,서울특별시 성동구 동호로 21(옥수동),37.5400509,127.0177866
87,3호선,을지로3가,서울특별시 중구 을지로 지하129(을지로3가),37.5664076,126.9936319
88,3호선,일원,서울특별시 강남구 일원로 지하121(일원동),37.4881652,127.0828815
89,3호선,잠원,서울특별시 서초구 잠원로4길 지하46(잠원동),37.5126755,127.0107095
90,3호선,종로3가,서울특별시 종로구 돈화문로 지하30(묘동),37.5720785,126.9920972
91,3호선,지축,경기도 고양시 덕양구 삼송로 300(지축동),37.6487922,126.911372
92,3호선,충무로,서울특별시 중구 퇴계로 지하214(필동2가),37.5587734,126.9947209
93,3호선,학여울,서울특별시 강남구 남부순환로 지하3104(대치동),37.493668,127.0619
94,3호선,홍제,서울특별시 서대문구 통일로 지하440-1(홍제동),37.5928868,126.9489057
95,4호선,길음,서울특별시 성북구 동소문로 지하248(길음동),37.6085948,127.0220461
96,4호선,남태령,서울특별시 서초구 과천대로 지하816(방배동),37.490797,126.9897777
97,4호선,노원,서울특별시 노원구 상계로 69-1(상계동),37.6561147,127.0623967
98,4호선,당고개,서울특별시 노원구 상계로 305(상계동),37.670607,127.0793321
99,4호선,동대문,서울특별시 종로구 율곡로 지하308(종로6가),37.5719508,127.0076798
100,4호선,동대문역사문화공원,서울특별시 중구 장충단로 지하230(광희동2가),37.5637333,127.0085617
101,4호선,동작(현충원),서울특별시 동작구 현충로 257(동작동),37.5028599,126.9799855
102,4호선,명동,서울특별시 중구 퇴계로 지하126(충무로2가),37.5617173,126.987815
103,4호선,미아,서울특별시 강북구 도봉로 지하198(미아동),37.6290856,127.0277879
104,4호선,미아사거리,서울특별시 강북구 도봉로 지하50(미아동),37.6290856,127.0277879
105,4호선,사당,서울특별시 동작구  동작대로 지하3(사당동),37.476559,126.981633
106,4호선,삼각지,서울특별시 용산구 한강대로 지하180(한강로1가),37.5325443,126.9747393
107,4호선,상계,서울특별시 노원구 상계로 182(상계동),37.6610573,127.0736304
108,4호선,서울역,서울특별시 용산구 한강대로 지하392(동자동),37.5520713,126.9724315
109,4호선,성신여대입구(돈암),서울특별시 성북구 동소문로 지하102(동선동4가),37.5935975,127.01756
110,4호선,수유(강북구청),서울특별시 강북구 도봉로 지하338(수유동),37.6290856,127.0277879
111,4호선,숙대입구(갈월),서울특별시 용산구 한강대로 지하306(갈월동),37.5454036,126.9723606
112,4호선,신용산,서울특별시 용산구 한강대로 지하112(한강로2가),37.5306984,126.9707163
113,4호선,쌍문,서울특별시 도봉구 도봉로 지하 486-1(창동),37.6675936,127.0403191
114,4호선,이촌(국립중앙박물관),서울특별시 용산구 서빙고로 지하83(용산동5가),37.5261469,126.9745744
115,4호선,창동,서울특별시 도봉구 마들로11길 77(창동),37.6533776,127.0476817
116,4호선,총신대입구(이수),서울특별시 동작구 동작대로 지하117(사당동),37.476559,126.981633
117,4호선,충무로,서울특별시 중구 퇴계로 지하214(필동2가),37.5587734,126.9947209
118,4호선,한성대입구(삼선교),서울특별시 성북구 삼선교로 지하1(삼선동1가),37.5885903,127.0103548
119,4호선,혜화,서울특별시 종로구 대학로 지하120(명륜4가),37.5816314,127.0008865
120,4호선,회현(남대문시장),서울특별시 중구 퇴계로 지하54(남창동),37.5580788,126.9776197
121,5호선,강동,서울특별시 강동구 천호대로 지하1097(천호동),37.5443765,127.1276202
122,5호선,강일,서울특별시 강동구 고덕로 지하456(강일동),37.5570545,127.169184
123,5호선,개롱,서울특별시 송파구 오금로 지하402(가락동),37.4956865,127.1184047
124,5호선,개화산,서울특별시 강서구 양천로 22(방화동),37.564519,126.8110207
125,5호선,거여,서울특별시 송파구 오금로 지하499(거여동),37.4897279,127.1449912
126,5호선,고덕,서울특별시 강동구 고덕로 지하253(고덕동),37.555406,127.155926
127,5호선,공덕,서울특별시 마포구 마포대로 지하100(공덕동),37.5511348,126.9583888
128,5호선,광나루(장신대),서울특별시 광진구 아차산로 지하571(광장동),37.5408623,127.09657
129,5호선,광화문(세종문화회관),서울특별시 종로구 세종대로 지하172(세종로),37.5722099,126.9768146
130,5호선,군자(능동),서울특별시 광진구 천호대로 지하550(능동),37.5505785,127.0817378
131,5호선,굽은다리(강동구민회관앞),서울특별시 강동구 양재대로 지하1572(명일동),37.5490445,127.1508229
132,5호선,길동,서울특별시 강동구 양재대로 지하1480(길동),37.5396157,127.1459293
133,5호선,김포공항,서울특별시 강서구 하늘길 지하77(방화동),37.5557019,126.8045874
134,5호선,까치산,서울특별시 강서구 강서로 지하54(화곡동),37.5402954,126.8596478
135,5호선,답십리,서울특별시 성동구 천호대로 지하300(용답동),37.5645064,127.0575456
136,5호선,동대문역사문화공원,서울특별시 중구 마른내로 지하162(광희동1가),37.5650361,127.0059266
137,5호선,둔촌동,서울특별시 강동구 양재대로 지하1369(둔촌동),37.527657,127.136231
138,5호선,마곡,서울특별시 강서구 공항대로 지하163(마곡동),37.5745847,126.8278331
139,5호선,마장,서울특별시 성동구 마장로 지하296(마장동),37.567372,127.0349439
140,5호선,마천,서울특별시 송파구 마천로57길 지하7(마천동),37.4952383,127.1532327
141,5호선,마포,서울특별시 마포구 마포대로 지하33(도화동),37.5389594,126.9491776
142,5호선,명일,서울특별시 강동구 양재대로 지하1632(명일동),37.5490445,127.1508229
143,5호선,목동,서울특별시 양천구 오목로 지하245(목동),37.526072,126.864301
144,5호선,미사,경기도 하남시 미사강변동로 지하90(망월동),37.5637007,127.1929312
145,5호선,발산,서울특별시 강서구 공항대로 지하267(마곡동),37.5706297,126.8298909
146,5호선,방이,서울특별시 송파구 양재대로 지하1127(방이동),37.511246,127.1293615
147,5호선,방화,서울특별시 강서구 금낭화로 지하132(방화동),37.5782048,126.8181658
148,5호선,상일동,서울특별시 강동구 고덕로 지하359(상일동),37.5570545,127.169184
149,5호선,서대문,서울특별시 종로구 통일로 지하126(평동),37.5680974,126.9687373
150,5호선,송정,서울특별시 강서구 공항대로 지하33(공항동),37.5610725,126.8117129
151,5호선,신금호,서울특별시 성동구 금호로 지하154(금호동2가),37.5530275,127.020416
152,5호선,신길,서울특별시 영등포구 경인로114가길 지하9(영등포동1가),37.517435,126.9152987
153,5호선,신정(은행정),서울특별시 양천구 오목로 지하179(신정동),37.5238539,126.8584224
154,5호선,아차산(어린이대공원후문),서울특별시 광진구 천호대로 지하657(능동),37.5505785,127.0817378
155,5호선,애오개,서울특별시 마포구 마포대로 지하210(아현동),37.5544849,126.9562273
156,5호선,양평,서울특별시 영등포구 양산로 지하21(양평동2가),37.5229518,126.8835309
157,5호선,여의나루,서울특별시 영등포구 여의동로 지하343(여의도동),37.5234916,126.930651
158,5호선,여의도,서울특별시 영등포구 여의나루로 지하40(여의도동),37.5213559,126.9249795
159,5호선,영등포구청,서울특별시 영등포구 양산로 지하116(당산동3가),37.5269397,126.8985416
160,5호선,영등포시장,서울특별시 영등포구 양산로 지하200(영등포동5가),37.5210747,126.9066805
161,5호선,오금,서울특별시 송파구 오금로 지하321(오금동),37.5041934,127.1344585
162,5호선,오목교(목동운동장앞),서울특별시 양천구 오목로 지하342(목동),37.526072,126.864301
163,5호선,올림픽공원(한국체대),서울특별시 송파구 양재대로 지하1233(방이동),37.511246,127.1293615
164,5호선,왕십리,서울특별시 성동구 왕십리로 지하300(행당동),37.5596331,127.0303221
165,5호선,우장산,서울특별시 강서구 강서로 지하262(화곡동),37.5512896,126.8417531
166,5호선,을지로4가,서울특별시 중구 창경궁로 지하51(주교동),37.56889,126.9995436
167,5호선,장한평,서울특별시 동대문구 천호대로 지하405(장안동),37.564181,127.0633192
168,5호선,종로3가(탑골공원),서울특별시 종로구 돈화문로11길 지하 26(돈의동),37.572586,126.9900433
169,5호선,천호(풍납토성),서울특별시 강동구 천호대로 지하997(천호동),37.5443765,127.1276202
170,5호선,청구,서울특별시 중구 청구로 지하77(신당동),37.5607672,127.0144712
171,5호선,충정로(경기대입구),서울특별시 서대문구 충정로 지하 28-1(충정로3가),37.5624087,126.9615382
172,5호선,하남검단산역,경기도 하남시 대청로 지하100(창우동),37.5396625,127.2281275
173,5호선,하남시청(덕풍·신장),경기도 하남시 하남대로 지하820(덕풍동),37.5476396,127.2089488
174,5호선,하남풍산,경기도 하남시 덕풍서로 지하50(덕풍동),37.5518381,127.2029261
175,5호선,행당,서울특별시 성동구 행당로 지하89(행당동),37.5567086,127.0272721
176,5호선,화곡,서울특별시 강서구 화곡로 지하168(화곡동),37.5487046,126.8450968
177,6호선,고려대(종암),서울특별시 성북구 종암로 지하1(종암동),37.5981288,127.0404024
178,6호선,공덕,서울특별시 마포구 백범로 지하200(공덕동),37.5491304,126.9516779
179,6호선,광흥창(서강),서울특별시 마포구 독막로 지하165(창전동),37.5452972,126.9310644
180,6호선,구산,서울특별시 은평구 연서로 지하137-1(구산동),37.6134018,126.9050205
181,6호선,녹사평(용산구청),서울특별시 용산구 녹사평대로 지하195(용산동4가),37.5305359,126.9851825
182,6호선,대흥(서강대앞),서울특별시 마포구 대흥로 지하85(대흥동),37.5497599,126.9431416
183,6호선,독바위,서울특별시 은평구 불광로 지하129-1(불광동),37.6217371,126.9272708
184,6호선,돌곶이,서울특별시 성북구 화랑로 지하243(석관동),37.611277,127.0580352
185,6호선,동묘앞,서울특별시 종로구 지봉로 지하24(숭인동),37.5753626,127.0154315
186,6호선,디지털미디어시티,서울특별시 은평구 수색로 지하175(증산동),37.58214359999999,126.9062444
187,6호선,마포구청,서울특별시 마포구 월드컵로 지하190(성산동),37.5656178,126.9046897
188,6호선,망원,서울특별시 마포구 월드컵로 지하77(망원동),37.5554884,126.8998606
189,6호선,버티고개,서울특별시 중구 다산로 지하38(신당동),37.5599012,127.0198098
190,6호선,보문,서울특별시 성북구 보문로 지하116(보문동1가),37.5866501,127.0196841
191,6호선,봉화산(서울의료원),서울특별시 중랑구 신내로 지하232(신내동),37.6109947,127.0937399
192,6호선,불광,서울특별시 은평구 통일로 지하723-1(대조동),37.61204770000001,126.923359
193,6호선,삼각지,서울특별시 용산구 한강대로 지하185(한강로1가),37.5329296,126.9744105
194,6호선,상수,서울특별시 마포구 독막로 지하85(상수동),37.54961590000001,126.9224682
195,6호선,상월곡(한국과학기술연구원),서울특별시 성북구 화랑로 지하157(상월곡동),37.6060997,127.0478098
196,6호선,새절(신사),서울특별시 은평구 증산로 지하400(신사동),37.595613,126.9072033
197,6호선,석계,서울특별시 노원구 화랑로 지하 347-1(월계동),37.6282394,127.0567599
198,6호선,신내,서울특별시 중랑구 용마산로136길 33 신내차량기지,37.6190542,127.1073132
199,6호선,신당,서울특별시 중구 다산로 지하260(흥인동),37.56731,127.0163823
200,6호선,안암(고대병원앞),서울특별시 성북구 고려대로 지하89(안암동5가),37.5860125,127.025563
201,6호선,약수,서울특별시 중구 다산로 지하115(신당동),37.5587251,127.0120213
202,6호선,역촌,서울특별시 은평구 서오릉로 지하63(녹번동),37.6005677,126.938577
203,6호선,연신내,서울특별시 은평구 통일로 지하849(갈현동),37.621541,126.913578
204,6호선,월곡(동덕여대),서울특별시 성북구 월곡로 지하107(하월곡동),37.5971779,127.0392309
205,6호선,월드컵경기장(성산),서울특별시 마포구 월드컵로 지하240(성산동),37.5592762,126.9138751
206,6호선,응암,서울특별시 은평구 증산로 지하477(신사동),37.595613,126.9072033
207,6호선,이태원,서울특별시 용산구 이태원로 지하177(이태원동),37.5342345,126.9905368
208,6호선,증산(명지대앞),서울특별시 은평구 증산로 지하306(증산동),37.5841679,126.9059643
209,6호선,창신,서울특별시 종로구 지봉로 지하112(창신동),37.5753626,127.0154315
210,6호선,청구,서울특별시 중구 청구로 지하77(신당동),37.5607672,127.0144712
211,6호선,태릉입구,서울특별시 노원구 동일로 지하 992-1(공릉동),37.6304722,127.0909904
212,6호선,한강진,서울특별시 용산구 이태원로 지하287(한남동),37.5339827,127.0110273
213,6호선,합정,서울특별시 마포구 양화로 지하45(합정동),37.5495753,126.9139908
214,6호선,화랑대(서울여대입구),서울특별시 노원구 화랑로 지하510(공릉동),37.6280947,127.091262
215,6호선,효창공원앞,서울특별시 용산구 백범로 지하287(효창동),37.5395736,126.963503
216,7호선,가산디지털단지,서울특별시 금천구 벚꽃로 309(가산동),37.4824123,126.8822401
217,7호선,강남구청,서울특별시 강남구 학동로 지하346(삼성동),37.51673170000001,127.042221
218,7호선,건대입구,서울특별시 광진구 능동로 지하110(화양동),37.5463089,127.0729231
219,7호선,고속터미널,서울특별시 서초구 신반포로 지하188(반포동),37.5054982,127.0011512
220,7호선,공릉(서울과학기술대),서울특별시 노원구 동일로 지하1074(공릉동),37.6304722,127.0909904
221,7호선,광명사거리,경기도 광명시 오리로 지하980(광명동),37.4717061,126.8526377
222,7호선,군자(능동),서울특별시 광진구 천호대로 지하550(능동),37.5505785,127.0817378
223,7호선,남구로,서울특별시 구로구 도림로 지하7(구로동),37.5050823,126.8887869
224,7호선,남성,서울특별시 동작구 사당로 지하218(사당동),37.4889312,126.9691198
225,7호선,내방,서울특별시 서초구 서초대로 지하103(방배동),37.4910405,127.004581
226,7호선,노원,서울특별시 노원구 동일로 지하1409(상계동),37.6543386,127.0626961
227,7호선,논현,서울특별시 강남구 학동로 지하102(논현동),37.5201287,127.0393976
228,7호선,대림(구로구청),서울특별시 영등포구 도림로 지하137(대림동),37.4954266,126.9001326
229,7호선,도봉산,서울특별시 도봉구 도봉로 964-40(도봉동),37.6890338,127.0466673
230,7호선,뚝섬유원지,서울특별시 광진구 능동로 10(자양동),37.540458,127.066694
231,7호선,마들,서울특별시 노원구 동일로 지하1530-1(상계동),37.6543386,127.0626961
232,7호선,먹골,서울특별시 중랑구 동일로 지하901(묵동),37.5976182,127.0790622
233,7호선,면목,서울특별시 중랑구 면목로 지하407(면목동),37.5845464,127.0905862
234,7호선,반포,서울특별시 서초구 신반포로 지하241(잠원동),37.5151065,127.0137779
235,7호선,보라매,서울특별시 동작구 상도로 지하2(대방동),37.5062327,126.93435
236,7호선,사가정,서울특별시 중랑구 사가정로 지하393(면목동),37.5719656,127.0845223
237,7호선,상도,서울특별시 동작구 상도로 지하272(상도1동),37.5032626,126.9506566
238,7호선,상봉(시외버스터미널),서울특별시 중랑구 망우로 297(상봉동),37.5967657,127.0860297
239,7호선,수락산,서울특별시 노원구 동일로 지하1662(상계동),37.6543386,127.0626961
240,7호선,숭실대입구(살피재),서울특별시 동작구 상도로 지하378(상도동),37.4990513,126.9422048
241,7호선,신대방삼거리,서울특별시 동작구 상도로 지하76(대방동),37.5143563,126.932638
242,7호선,신풍,서울특별시 영등포구 신풍로 지하27(신길동),37.5001413,126.9131951
